require spatial

statement ok
CREATE TABLE t1 AS SELECT point::GEOMETRY as geom
FROM st_generatepoints({min_x: 0, min_y: 0, max_x: 10000, max_y: 10000}::BOX_2D, 10000, 1337);

query I
SELECT count(*) FROM t1;
----
10000

statement ok
CREATE INDEX my_idx ON t1 USING RTREE (geom) WITH (min_node_capacity = 0);

statement ok
DELETE FROM t1;

query I
SELECT count(*) FROM t1;
----
0