require spatial

statement ok
CREATE TABLE t1 AS SELECT point::GEOMETRY as geom
FROM st_generatepoints({min_x: 0, min_y: 0, max_x: 1000, max_y: 1000}::BOX_2D, 10000, 1337);

statement ok
INSERT INTO t1 (geom) VALUES ('POINT(1 1)');

statement ok
CREATE INDEX my_idx ON t1 USING RTREE (geom);

query I
DELETE FROM t1 WHERE geom = 'POINT(1 1)';
----
1

query I
SELECT * FROM t1 WHERE st_intersects(geom, 'POINT(1 1)');
----

statement ok
DROP INDEX my_idx;

statement ok
INSERT INTO t1 (geom) SELECT * FROM st_generatepoints({min_x: 0, min_y: 0, max_x: 1000, max_y: 1000}::BOX_2D, 1000, 1337);

query I
SELECT count(*) FROM t1;
----
11000

statement ok
CREATE INDEX my_idx ON t1 USING RTREE (geom);

statement ok
DELETE FROM t1;

query I
SELECT count(*) FROM t1;
----
0