require spatial

statement ok
CREATE TABLE t1(i INT, g GEOMETRY);

statement ok
CREATE INDEX my_idx ON t1 USING RTREE(g);

statement ok
INSERT INTO t1 VALUES (1, ST_GeomFromText('POLYGON EMPTY'));

query I
SELECT COUNT(*) FROM t1 WHERE st_intersects(g, st_makeenvelope(0, 0, 1, 1));
----
0

statement ok
INSERT INTO t1 VALUES (1, ST_GeomFromText('POLYGON ((0 0, 0 1, 1 1, 1 0, 0 0))'));

query I
SELECT COUNT(*) FROM t1;
----
2

query I
SELECT COUNT(*) FROM t1 WHERE st_intersects(g, st_makeenvelope(0, 0, 1, 1));
----
1

statement ok
DELETE FROM t1 WHERE i = 1;

query I
SELECT COUNT(*) FROM t1 WHERE st_intersects(g, st_makeenvelope(0, 0, 1, 1));
----
0